{"$schema":"https://json-schema.org/draft/2020-12/schema","title":"Evidence","type":"object","required":["evidence_id","claim_id","source_id","relationship","version"],"properties":{"evidence_id":{"type":"string"},"claim_id":{"type":"string"},"source_id":{"type":"string"},"relationship":{"enum":["reports_claim","directly_establishes","officially_determines","is_subject_statement","indirectly_informs","contradicts_claim","contextualizes_claim","retracts_or_corrects"]},"excerpt_reference":{"type":["string","null"]},"evidence_notes":{"type":"string"},"independence_group":{"type":["string","null"]},"confidence":{"$ref":"confidence.schema.json"},"version":{"type":"integer","minimum":1},"previous_version_id":{"type":["string","null"]}}}